<?xml version="1.0" encoding="UTF-8"?>
<nffgs 
	xmlns="http://www.example.org/nffgVerifier" 
	xmlns:xsi="http://www.w3.org/2001/XMLSchema-instance" 
	xsi:schemaLocation="http://www.example.org/nffgVerifier nffgVerifier.xsd ">


	<nffg href="http://localhost:8080/NffgService/rest/nffg/nffg1">
		<name>nffg1</name>
		<lastUpdate>2015-07-21T21:00:00.000+02:00</lastUpdate>
	<nodes>
		<node>
			<name>nodo1</name>
			<functionality>FW</functionality>
		</node>
		
		<node>
			<name>nodo2</name>
			<functionality>FW</functionality>
		</node>

		<node>
			<name>nodo3</name>
			<functionality>NAT</functionality>
		</node>

		<node>
			<name>nodo4</name>
			<functionality>DPI</functionality>
		</node>

		<node>
			<name>nodo5</name>
			<functionality>DPI</functionality>
		</node>

		<node>
			<name>nodo6</name>
			<functionality>DPI</functionality>
		</node>
	</nodes>
	<links>
		<link>
			<name>link1</name>
			<src>nodo1</src>
			<dst>nodo2</dst>
		</link>

		<link>
			<name>link2</name>
			<src>nodo1</src>
			<dst>nodo3</dst>
		</link>
	</links>
	
	</nffg>

	<nffg href="http://localhost:8080/NffgService/rest/nffg/nffg2">
		<name>nffg2</name>
		<lastUpdate>2015-07-21T21:00:00.000+02:00</lastUpdate>
	<nodes>
	
		<node>
			<name>nodo1</name>
			<functionality>FW</functionality>
		</node>

		<node>
			<name>nodo2</name>
			<functionality>NAT</functionality>
		</node>

		<node>
			<name>nodo3</name>
			<functionality>DPI</functionality>
		</node>

		<node>
			<name>nodo4</name>
			<functionality>DPI</functionality>
		</node>

		<node>
			<name>nodo5</name>
			<functionality>DPI</functionality>
		</node>
	</nodes>
	<links>
		<link>
			<name>link1</name>
			<src>nodo1</src>
			<dst>nodo5</dst>
		</link>

		<link>
			<name>link2</name>
			<src>nodo2</src>
			<dst>nodo3</dst>
		</link>
	</links>

	</nffg>
</nffgs>
